ALTER DATABASE contrib_regression SET pgcrypto.fips TO on;
\c contrib_regression
SHOW pgcrypto.fips;
 pgcrypto.fips 
---------------
 on
(1 row)

CREATE TABLE fipstest (data text, res text, salt text);
NOTICE:  Table doesn't have 'DISTRIBUTED BY' clause -- Using column named 'data' as the Greenplum Database data distribution key for this table.
HINT:  The 'DISTRIBUTED BY' clause determines the distribution of data. Make sure column(s) chosen are the optimal data distribution key to minimize skew.
INSERT INTO fipstest VALUES ('password', '', '');
SELECT 'Test digest md5: EXPECTED ERROR FAIL FIPS' as comment;
                  comment                  
-------------------------------------------
 Test digest md5: EXPECTED ERROR FAIL FIPS
(1 row)

SELECT digest('santa claus', 'md5');
ERROR:  Cannot use "md5": Some PX error (not specified)
SELECT 'Test digest sha256: EXPECTED PASS' as comment;
              comment              
-----------------------------------
 Test digest sha256: EXPECTED PASS
(1 row)

SELECT digest('santa claus', 'sha256');
                                       digest                                        
-------------------------------------------------------------------------------------
 g[\217a\374'\024\013_\006\376\304a=\213=\233\221:\202\007MLy\003tU\214\030\322\313}
(1 row)

SELECT 'Test hmac md5: EXPECTED ERROR FAIL FIPS' as comment;
                 comment                 
-----------------------------------------
 Test hmac md5: EXPECTED ERROR FAIL FIPS
(1 row)

SELECT hmac('santa claus', 'aaa', 'md5');
ERROR:  Cannot use "md5": Some PX error (not specified)
SELECT 'Test hmac sha256: EXPECTED PASS' as comment;
             comment             
---------------------------------
 Test hmac sha256: EXPECTED PASS
(1 row)

SELECT hmac('santa claus', 'aaa', 'sha256');
                                           hmac                                            
-------------------------------------------------------------------------------------------
 \310\217\350\377\005A\261\273%\253\331q\372vB\322V\241\300\020\237~V\207]Y:=\252\352\317T
(1 row)

SELECT 'Test gen_salt : EXPECTED FAIL FIPS' as comment;
              comment               
------------------------------------
 Test gen_salt : EXPECTED FAIL FIPS
(1 row)

UPDATE fipstest SET salt = gen_salt('md5');
ERROR:  requested functionality not allowed in FIPS mode (pgcrypto.c:200)  (seg2 172.31.9.221:25434 pid=14537) (cdbdisp.c:254)
SELECT 'Test crypt : EXPECTED FAIL FIPS' as comment;
             comment             
---------------------------------
 Test crypt : EXPECTED FAIL FIPS
(1 row)

UPDATE fipstest SET res = crypt(data, salt);
ERROR:  requested functionality not allowed in FIPS mode (pgcrypto.c:253)  (seg2 172.31.9.221:25434 pid=14537) (cdbdisp.c:254)
SELECT res = crypt(data, res) AS "worked" FROM fipstest;
ERROR:  requested functionality not allowed in FIPS mode (pgcrypto.c:253)  (seg2 slice1 172.31.9.221:25434 pid=14537) (cdbdisp.c:254)
SELECT 'Test pgp : EXPECTED PASS' as comment;
         comment          
--------------------------
 Test pgp : EXPECTED PASS
(1 row)

select pgp_sym_decrypt(pgp_sym_encrypt('santa clause', 'mypass', 'cipher-algo=aes256'), 'mypass');
 pgp_sym_decrypt 
-----------------
 santa clause
(1 row)

SELECT 'Test pgp : EXPECTED FAIL FIPS' as comment;
            comment            
-------------------------------
 Test pgp : EXPECTED FAIL FIPS
(1 row)

select pgp_sym_decrypt(pgp_sym_encrypt('santa clause', 'mypass', 'cipher-algo=bf'), 'mypass');
ERROR:  Unsupported cipher algorithm
SELECT 'Test raw encrypt : EXPECTED PASS' as comment;
             comment              
----------------------------------
 Test raw encrypt : EXPECTED PASS
(1 row)

SELECT encrypt('santa claus', 'mypass', 'aes') as raw_aes;
                      raw_aes                      
---------------------------------------------------
 \347\254:\325{\336Y\305\267\214\010\200Z\375\267t
(1 row)

SELECT 'Test raw encrypt : EXPECTED FAIL FIPS' as comment;
                comment                
---------------------------------------
 Test raw encrypt : EXPECTED FAIL FIPS
(1 row)

SELECT encrypt('santa claus', 'mypass', 'bf') as raw_blowfish;
ERROR:  requested functionality not allowed in FIPS mode (openssl.c:756)
DROP TABLE fipstest;
