-- start_matchsubs
-- m/nodeModifyTable.c:\d+/
-- s/nodeModifyTable.c:\d+/nodeModifyTable.c:XXX/
-- end_matchsubs

-- start_ignore
drop table tab1;
ERROR:  table "tab1" does not exist
drop table tab2;
ERROR:  table "tab2" does not exist
drop table tab3;
ERROR:  table "tab3" does not exist
-- end_ignore

-- We do some check to verify the tuple to delete|update
-- is from the segment it scans out. This case is to test
-- such check.
-- We build a plan that will add motion above result relation,
-- however, does not contain explicit motion to send tuples back,
-- and then login in segment using utility mode to insert some
-- bad data.

create table tab1(a int, b int) distributed by (b);
CREATE
create table tab2(a int, b int) distributed by (a);
CREATE
create table tab3 (a int, b int) distributed by (b);
CREATE

insert into tab1 values (1, 1);
INSERT 1
insert into tab2 values (1, 1);
INSERT 1
insert into tab3 values (1, 1);
INSERT 1

set allow_system_table_mods='dml';
SET
update pg_class set relpages = 10000 where relname='tab2';
UPDATE 1
update pg_class set reltuples = 100000000 where relname='tab2';
UPDATE 1
update pg_class set relpages = 100000000 where relname='tab3';
UPDATE 1
update pg_class set reltuples = 100000 where relname='tab3';
UPDATE 1

select dbid, content from gp_segment_configuration;
dbid|content
----+-------
1   |-1     
2   |0      
3   |1      
4   |2      
5   |0      
6   |1      
7   |2      
8   |-1     
(8 rows)
-- 5x's islation2 framework use dbid to specify utility target
-- 3 should be the seg1 for demo cluster with mirrors
3U: insert into tab1 values (1, 1);
INSERT 1

select gp_segment_id, * from tab1;
gp_segment_id|a|b
-------------+-+-
1            |1|1
0            |1|1
(2 rows)

-- planner does not error out because it will add explicit motion
-- For orca, this will error out
explain delete from tab1 using tab2, tab3 where tab1.a = tab2.a and tab1.b = tab3.a;
QUERY PLAN                                                                                                                         
-----------------------------------------------------------------------------------------------------------------------------------
Delete  (cost=0.00..8119.05 rows=1 width=1)                                                                                        
  ->  Result  (cost=0.00..8119.02 rows=1 width=22)                                                                                 
        ->  Redistribute Motion 3:3  (slice3; segments: 3)  (cost=0.00..8119.02 rows=1 width=18)                                   
              Hash Key: public.tab1.b                                                                                              
              ->  Hash Join  (cost=0.00..8119.02 rows=1 width=18)                                                                  
                    Hash Cond: tab3.a = public.tab1.b                                                                              
                    ->  Table Scan on tab3  (cost=0.00..431.70 rows=33334 width=4)                                                 
                    ->  Hash  (cost=7681.20..7681.20 rows=1 width=18)                                                              
                          ->  Broadcast Motion 3:3  (slice2; segments: 3)  (cost=0.00..7681.20 rows=1 width=18)                    
                                ->  Hash Join  (cost=0.00..7681.20 rows=1 width=18)                                                
                                      Hash Cond: tab2.a = public.tab1.a                                                            
                                      ->  Table Scan on tab2  (cost=0.00..1127.67 rows=33333334 width=4)                           
                                      ->  Hash  (cost=431.00..431.00 rows=1 width=18)                                              
                                            ->  Redistribute Motion 3:3  (slice1; segments: 3)  (cost=0.00..431.00 rows=1 width=18)
                                                  Hash Key: public.tab1.a                                                          
                                                  ->  Table Scan on tab1  (cost=0.00..431.00 rows=1 width=18)                      
Optimizer status: PQO version 3.86.0                                                                                               
(17 rows)
begin;
BEGIN
delete from tab1 using tab2, tab3 where tab1.a = tab2.a and tab1.b = tab3.a;
ERROR:  distribution key of the tuple (0, 1) doesn't belong to current segment (actually from seg1) (nodeDML.c:136)  (seg0 127.0.1.1:25432 pid=127638) (cdbdisp.c:254)
abort;
ABORT

-- For orca, this will error out
explain update tab1 set a = 999 from tab2, tab3 where tab1.a = tab2.a and tab1.b = tab3.a;
QUERY PLAN                                                                                                                                     
-----------------------------------------------------------------------------------------------------------------------------------------------
Update  (cost=0.00..8119.09 rows=1 width=1)                                                                                                    
  ->  Result  (cost=0.00..8119.02 rows=1 width=26)                                                                                             
        ->  Redistribute Motion 3:3  (slice3; segments: 3)  (cost=0.00..8119.02 rows=1 width=22)                                               
              Hash Key: public.tab1.b                                                                                                          
              ->  Split  (cost=0.00..8119.02 rows=1 width=22)                                                                                  
                    ->  Result  (cost=0.00..8119.02 rows=1 width=22)                                                                           
                          ->  Hash Join  (cost=0.00..8119.02 rows=1 width=18)                                                                  
                                Hash Cond: tab3.a = public.tab1.b                                                                              
                                ->  Table Scan on tab3  (cost=0.00..431.70 rows=33334 width=4)                                                 
                                ->  Hash  (cost=7681.20..7681.20 rows=1 width=18)                                                              
                                      ->  Broadcast Motion 3:3  (slice2; segments: 3)  (cost=0.00..7681.20 rows=1 width=18)                    
                                            ->  Hash Join  (cost=0.00..7681.20 rows=1 width=18)                                                
                                                  Hash Cond: tab2.a = public.tab1.a                                                            
                                                  ->  Table Scan on tab2  (cost=0.00..1127.67 rows=33333334 width=4)                           
                                                  ->  Hash  (cost=431.00..431.00 rows=1 width=18)                                              
                                                        ->  Redistribute Motion 3:3  (slice1; segments: 3)  (cost=0.00..431.00 rows=1 width=18)
                                                              Hash Key: public.tab1.a                                                          
                                                              ->  Table Scan on tab1  (cost=0.00..431.00 rows=1 width=18)                      
Optimizer status: PQO version 3.86.0                                                                                                           
(19 rows)
begin;
BEGIN
update tab1 set a = 999 from tab2, tab3 where tab1.a = tab2.a and tab1.b = tab3.a;
ERROR:  distribution key of the tuple (0, 1) doesn't belong to current segment (actually from seg1) (nodeDML.c:136)  (seg0 127.0.1.1:25432 pid=127638) (cdbdisp.c:254)
abort;
ABORT

-- Test splitupdate, 5x planner does not support splitupdate
-- if orca enabled, the following split update will error out
explain update tab1 set b = 999;
QUERY PLAN                                                                                     
-----------------------------------------------------------------------------------------------
Update  (cost=0.00..431.07 rows=1 width=1)                                                     
  ->  Result  (cost=0.00..431.00 rows=1 width=26)                                              
        ->  Redistribute Motion 3:3  (slice1; segments: 3)  (cost=0.00..431.00 rows=1 width=22)
              Hash Key: public.tab1.b                                                          
              ->  Split  (cost=0.00..431.00 rows=1 width=22)                                   
                    ->  Result  (cost=0.00..431.00 rows=1 width=22)                            
                          ->  Table Scan on tab1  (cost=0.00..431.00 rows=1 width=18)          
Optimizer status: PQO version 3.86.0                                                           
(8 rows)
begin;
BEGIN
update tab1 set b = 999;
ERROR:  distribution key of the tuple (0, 1) doesn't belong to current segment (actually from seg1) (nodeDML.c:136)  (seg0 127.0.1.1:25432 pid=127638) (cdbdisp.c:254)
abort;
ABORT

-- drop table tab1;
-- drop table tab2;
-- drop table tab3;
